Column1,Name,Description,Type,Reference,Sports,Spiritual,
190,Brain Injury Awareness Club,"The mission of BrainIAC is to foster a multi-disciplinary community of students who will come together to learn, discuss, engage in community outreach, and spread data-based awareness involving brain injuries. BrainIAC members will engage with researchers, patients, caretakers, and doctors in critical discussions, share stories of people impacted by brain injuries, and connect with the broader Durham community in outreach efforts. One of BrainIACâs top priorities is to acknowledge that we donât have all the answers yet, but as a group, we aspire to find them by opening our minds and thinking critically.",Group,https://dukegroups.com/BrainIAC/,0,0,
191,Men's Club Ultimate Frisbee,"To know about it, reach out to people from the reference link.",Group,https://dukegroups.com/Brimstone/,1,0,
192,Brown House Council,"To know about it, reach out to people from the reference link.",Group,https://dukegroups.com/Brown/,0,0,
193,Be The Match On Campus,"The mission of BTMOC is to aid people whose lives have been affected by blood cancer. BTMOCâs goals are to recruit committed potential bone marrow donors to the national registry, to raise more awareness in the community about blood cancer and the importance of marrow donation, and to generate funding to aid in the mission to save lives.â BTMOC will fulfill these goals by holding fundraising campaigns, bone marrow registry drives, and various other volunteering events.",Group,https://dukegroups.com/BTMOC/,0,0,
194,Bull City Scholars,"The mission of Bull City Scholars is to create a sustainable mentorship and tutoring program focused on college access for Durham middle school students that are currently not served by Duke’s Partnerships for Service. In order to support an informed model of service, students may participate in an optional, introductory house course investigating education inequality and pedagogy.",Group,https://dukegroups.com/BullCity/,0,0,
195,Black Women's Union,The Black Womenâs Union (BWU) is a student organization whose mission is to establish community among Black women and non-binary students at Duke and to provide opportunities for personal and professional development.,Group,https://dukegroups.com/BWU/,0,0,
196,Challah for Hunger at Duke (a project of Nazun),"The mission of CfH @ Duke is to foster a community environment in which all Duke students, regardless of religion, can come together to fight hunger, which is widespread throughout our world.  CfH @ Duke seeks to accomplish this goal by making and selling Challah bread on and off campus and using the proceeds to donate money to a global hunger organization and a local hunger organization in Durham.",Group,https://dukegroups.com/CfHDuke/,0,0,
197,Chabad Graduate Student Group,"To know about it, reach out to people from the reference link.",Group,https://dukegroups.com/ChabadGR/,0,0,
198,Duke Civic Engagement,"To know about it, reach out to people from the reference link.",Group,https://dukegroups.com/CivicEngagment/,0,0,
199,Clever Endeavor,"Through this mentorship program, C.E. aims to form a lasting connection among Duke, UNC, and elementary schools across the Durham and Chapel Hill communities. C.E. hopes to help children realize that hopes to help children realize that they are valued and they are the best thing that the world has to offer. C.E. seeks to bolster a childâs natural talent of curiosity and inquisitiveness, as well as understanding the developmental milestones of 4th and 5th graders, to promote in children a sense of positive identity, self-determination, empowerment, belief in their future, and prosocial involvement.",Group,https://dukegroups.com/Clever/,0,0,
200,Duke Climate Commitment,"To know about it, reach out to people from the reference link.",Group,https://dukegroups.com/climatecommitment/,0,0,
201,Club Field Hockey,"To know about it, reach out to people from the reference link.",Group,https://dukegroups.com/ClubFH/,1,0,
202,Club Golf,"The mission of Duke Club Golf is to provide an inclusive and fun team environment that gives members access to practices, events, and competitions surrounding the game of golf.",Group,https://dukegroups.com/ClubGolf/,1,0,
203,Club Running,"To know about it, reach out to people from the reference link.",Group,https://dukegroups.com/ClubRun/,1,0,
204,Club Softball,"To know about it, reach out to people from the reference link.",Group,https://dukegroups.com/ClubSoftball/,1,0,
205,Club Women's Volleyball,"To know about it, reach out to people from the reference link.",Group,https://dukegroups.com/ClubVball/,1,0,
206,Duke CommuniTEA,"The mission of Duke CommuniTEA is to promote a deeper understanding of different cultures through tea appreciation, to facilitate interactions among students using tea as a medium, and to provide a place for relaxation and wellness with the Duke community.",Group,https://dukegroups.com/CommuniTEA/,0,0,
207,The Connection Project,"The Connection Project is a leadership program for first-year students to make their place at Duke. The Connection Project is for first-year students who want to make friends at Duke, hone their leadership and interpersonal skills, build a network of students and mentors, and live authentically.",Group,https://dukegroups.com/ConnectionProject/,0,0,
208,The Connection Project,"The Connection Project is a leadership program for first-year students to make their place at Duke. The Connection Project is for first-year students who want to make friends at Duke, hone their leadership and interpersonal skills, build a network of students and mentors, and live authentically.",Group,https://dukegroups.com/ConnectionProject/,0,0,
209,The Connection Project,"The Connection Project is a leadership program for first-year students to make their place at Duke. The Connection Project is for first-year students who want to make friends at Duke, hone their leadership and interpersonal skills, build a network of students and mentors, and live authentically.",Group,https://dukegroups.com/ConnectionProject/,0,0,
210,The Coop,"We are the coop. Duke women deserve greater recognition and representation, and we are here to give it to them. We are committed to creating a supportive, inclusive community of women on and off our campus. In a time where we are separated physically, we want to have a space where we can come together, exchange ideas, and learn from one other. We hope you join us on this journey towards greater female empowerment at Duke.",Group,https://dukegroups.com/Coop/,0,0,
211,Duke University Coalition of Occupational Therapy Advocates for Diversity (COTAD),"To know about it, reach out to people from the reference link.",Group,https://dukegroups.com/COTAD/,0,0,
212,Craven Quad Council,"To know about it, reach out to people from the reference link.",Group,https://dukegroups.com/CravenQC/,0,0,
213,Crowell Quad Council,"To know about it, reach out to people from the reference link.",Group,https://dukegroups.com/CrowellQC/,0,0,
214,Duke Chinese Student Association,Our mission is to represent Chinese undergraduate students at Duke and to facilitate communications between Chinese students and the rest of the campus,Group,https://dukegroups.com/CSA/,0,0,
215,Duke's Chapter of the American Association for Men in Nursing,"This organization is an association of nurses and affilitaes within the Duke University and the Duke University Health System (DUHS) who are interested in increasing the visibility and inclusion of men in nursing. This organization is not only open to men, but to all individuals who stand to support diversity, inclusivity, and equity within nursing at all levels.",Group,https://dukegroups.com/DAAMN/,0,0,
216,Duke Association for Greater Gaming Education and Recreation,Provide a safe space for individuals to make new connections within the shared hobby of board games.,Group,https://dukegroups.com/DAGGER/,0,0,
217,JasÅ«r Magazine,"Our mission is to (1) build an inclusive community of diverse individuals united by a desire to engage with MENA+ studies, (2) empower students from and/or interested in the MENA+ region with a platform to showcase their work, and (3) inspire creativity and curiosity to curate deeper culturally- and historically-driven, nuanced perspectives on the region.",Group,https://dukegroups.com/DAME/,0,0,
218,Duke Applied Machine Learning Group,"D.A.M.L  is an undergraduate club open to graduate students that provides all interested Duke students access to real-world tech projects and experience to help educate and prepare them for technical careers in industry or academia. We specialize in applied machine learning, software engineer, and hardware engineering.",Group,https://dukegroups.com/DAMLG/,0,0,
219,Duke Actuarial Society,"The mission of DAS is to create a pre-professional community of students interested in pursuing a career in the actuarial sciences. The organisation not only aims to increase the momentum around the actuarial sciences at Duke, but also aims to act as a resource for students interested in the career path. We aim to provide Duke students the opportunity to connect with the broader actuarial community, network with prominent actuarial firms, participate in risk management case competitions, and provide exam support. The organisation will hold speaker series, networking events, alumni job shadow days, study sessions, and internal bonding activities to create a tight-knit and informed actuarial community at Duke.",Group,https://dukegroups.com/DAS/,0,0,
220,Duke ASL,"The mission of DASL is to provide free, on-campus American Sign Language instruction for club members. DASL seeks to accomplish this mission by securing University funding, hiring an instructor, and holding biweekly group lessons on campus. DASL will also host group meetings and service events.",Group,https://dukegroups.com/DASL/,0,0,
221,Black Pre-Law Society at Duke,"To know about it, reach out to people from the reference link.",Group,https://dukegroups.com/DBPLS/,0,0,
222,Duke Brazilian Student Association,"Duke BRASA aims to connect Dukeâs Brazilian undergraduate student body, providing them with professional, social, academic, and identity support. BRASA shall abide by all Duke University and Duke Student Government policies.",Group,https://dukegroups.com/DBRASA/,0,0,
223,DBS Raas,"The mission of Bull City Raas is to perform garba and raas, which are Indian folk dance styles and music from Gujarat (Western India). Raas seeks to accomplish this goal by incorporating students from all cultural backgrounds to learn about various cultures, while exposing students to Indian folk culture and music. Raas intends to attend competitions and showcases nationally.",Group,https://dukegroups.com/DBSR/,0,0,
224,Duke Collegiate 100 Black Men,"The mission of 100 BM  is to create a community of students that will hold social and educational programming to work to better understand how we can work to become better people. 100 BM  will seek to accomplish this mission by holding bi-weekly body meetings, game nights, cookouts, guest speakers, and opportunities to connect with the broader Duke community.",Group,https://dukegroups.com/DC100/,0,0,
225,Durham and Community Affairs,"To know about it, reach out to people from the reference link.",Group,https://dukegroups.com/DCA/,0,0,
226,Duke Children's Ambassadors Program,The mission of the Duke Childrenâs Ambassador Program is to bridge the gap between the,Group,https://dukegroups.com/DCAP/,0,0,
227,Duke Catholic Center Graduate Students,"The Duke Catholic Center is a spiritual home for students at Duke University. We seek to create a welcoming Catholic community grounded in the Eucharist, intellectual growth in faith, social justice, and the nurturing of leaders.",Group,https://dukegroups.com/DCCGS/,0,1,
228,Duke Club Pickleball,"The purpose of Duke Club Pickleball is to provide an opportunity for Duke University students to learn and play the sport of pickleball in a friendly and competitive environment. Our goals are to host open campus-wide tournaments to promote our club and pickleball to all who are interested. We plan to represent Duke at other college campuses during intercollegiate tournaments and will equip members to be successful pickleball players.   Our mission is to help further the knowledge of pickleball and inspire collegiate pickleball clubs across the city, state, and nation, starting in the Triangle Area of North Carolina.",Group,https://dukegroups.com/DCPB/,1,0,
229,Duke University Chinese Students and Scholars Association,"Duke Chinese Student and Scholar Association (DCSSA), a non-profit organization consisting of Chinese students, scholars, staff and faculty at Duke University, is established with the mission of mutual help and service. The purpose of DCSSA is to serve and consolidate its Duke Chinese community as well as those interested in Chinese culture, and promote the exchange among its members, Duke community and Duke alumni.",Group,https://dukegroups.com/DCSSA/,0,0,
230,Duke Disability Alliance,"DDAâs mission is to make Duke more inclusive and accessible by fostering conversations about disability issues, expanding accessibility on campus and in the community, encouraging positive perceptions and full appreciation of people with disabilities, and promoting their legal rights. We strive to engage the entire Duke community to make Duke a better place for those with and without disabilities.",Group,https://dukegroups.com/DDA/,0,0,
231,Duke Dance Expressions,"The purpose of DDE shall be to provide free dance classes, exposure to a variety of dance forms, performance opportunities, and mentoring to underprivileged children who would not otherwise have access to formal dance training, especially ballet.",Group,https://dukegroups.com/DDE/,0,0,
232,DevilTHON: Duke Dance Marathon,We partner with the Childrenâs Miracle Network and Duke Childrenâs Hospital to raise money for kids and their families during the hardest time in their lives,Group,https://dukegroups.com/DDM/,0,0,
233,Duke Pre-Dental Society,"The Duke Pre-Dental Society aims to fill the absence of resources available to Duke undergraduates who are interested in or considering a career in Dentistry. Career choices include, but are not limited to the traditional private practice, consultation dentistry, specialties in dentistry (i.e. endodontics, periodontics, orthodontics, oral and maxillofacial surgery, etc), dental research and industry, public dental health, dental hygiene, dental assisting, academic dentistry and military dentistry.",Group,https://dukegroups.com/DDS/,0,0,
234,Duke Deewana,"The mission of Deewana is to foster South Asian and Western music through acapella and to create a space for Duke students to perform, create, and compete musically. Deewana seeks to achieve this goal by hosting performances and concerts by students within the organization, partnering with other student groups to present workshops or co-lead concerts and programs, and enabling outreach to the Durham community through live performance and community service.",Group,https://dukegroups.com/deewana/,0,0,
235,Define America,"Duke Define America is a student-led club that advocates for justice for (im)migrants, refugees, and asylum seekers in the United States of America.",Group,https://dukegroups.com/Define/,0,0,
236,Duke Emergency Nursing Students,"To know about it, reach out to people from the reference link.",Group,https://dukegroups.com/DENS/,0,0,
237,Economics Student Union,"To know about it, reach out to people from the reference link.",Group,https://dukegroups.com/DESU/,0,0,
238,Duke VEX U Robotics Club,The mission of Duke VexU Robotics Club is to be a student-centered organization that strives to,Group,https://dukegroups.com/DEVIL/,0,0,
239,Devils After Dark,"Devils After Dark's mission is to enhance the experience of first-year students, center East Campus as an engaging environment in line with QuadEx's motto, and provide alternative avenues for student life on weekends outside of party culture through fun and engaging events that are consistently available!!",Group,https://dukegroups.com/DevilsAD/,0,0,
240,Devils' Kitchen,Our vision is to create a fully functioning restaurant workflow while also teaching students to cook and innovate and performing food service to the community.,Group,https://dukegroups.com/devilskitchen/,0,0,
241,Duke Gaming,The purpose is to be a multi-game gaming organization fostering both the casual and competitive gamers at Duke University. Our focus is to develop a gaming community on campus as well as promote gamers to compete in esports (or âeSportsâ) gaming tournaments with their respective game(s). The goal is to represent the university in a new realm of sports that has been waiting for several years to come.,Group,https://dukegroups.com/DGame/,1,0,
242,Duke Gay Straight Alliance,"Duke HSGSA is a student led organization consisting of LGBTQ+ allies within Duke University. Our mission is to provide a forum in which we can address and discuss LGBTQ+/gender equality issues, establish outreach and awareness regarding sexual health, and ultimately give a voice to those within the community.",Group,https://dukegroups.com/DGSA/,0,0,
243,DukeGIVE,The mission of DGV is to provide GED tutoring to underprivileged and marginalized groups in Durham. DGV seeks to accomplish this mission by weekly tutoring at the Durham Tech center in conjunction with Durham Literacy.,Group,https://dukegroups.com/DGV/,0,0,
244,Duke Hunting & Conservation Club,"The mission of The Duke Hunting & Conservation Club shall be to create a space for undergraduate students passionate about hunting and its role in conserving the environment. DHCC will cater to all types of hunters (deer, bird, boar, etc.), and will encourage students who are interested in hunting to join, regardless of their experience.  DHCC will use their space to create a tight-knit society with bi-weekly meetings, firearm safety courses, social gatherings, guest speakers, and hunting trips.",Group,https://dukegroups.com/DHCC/,0,0,
245,Duke History Union,"Duke History Union is dedicated to providing a space for students to take deep dives into the world of history. Through immersive experiences, engaging speakers, and student discussion, DHU strives to make our past a key part of our present.",Group,https://dukegroups.com/DHU/,0,0,
246,Duke Israel Public Affairs Committee,"The mission of DIPAC is to promote and strengthen the US-Israel relationship through the engagement of student leaders and direct involvement in the American political process. DIPAC seeks to accomplish its state goal by creating a focused organization that gives students the tools to politically advocate for the US-Israel relationship, educating them about ways students on a college campus can influence the political process and pursuing a strategy to support the relationship on campus.",Group,https://dukegroups.com/DIPAC/,0,0,
247,Duke Justice Project,"The mission of DJP is to serve local justice-involved youth and adults through service, advocacy, and education. DJP will seek to accomplish this mission through holding at least bi-weekly meetings, educational training, service events, and government engagement.",Group,https://dukegroups.com/DJP/,0,0,
248,Duke Law Run Club,Duke Law Run Club is an open community of Duke Law runners of all levels. We host weekly group runs on campus and represent Duke Law in other running events.,Group,https://dukegroups.com/DLRC/,0,0,
249,Club Men's Basketball,The Men's Club Basketball team exists to provide a welcoming community and a competitive environment for students at Duke who love the sport and desire greater structure than what pickup games in the rec center can provide. We compete against the many schools around North Carolina and beyond.,Group,https://dukegroups.com/DMCB/,1,0,
250,Duke MIDS Cloud Club,We provide Duke graduate students in the Master in Interdisciplinary Data Science (MIDS) program and those in other disciplines who are passionate about data engineering with a platform and community to build portfolio data engineering projects.,Group,https://dukegroups.com/DMCC/,0,0,
251,Duke Medical Ethics Journal,"As members of DMEJ, participants will gain first-hand editing experience and knowledge of how a publishing process works. In addition, members will work with students from other institutions to create the final product that culminates in the DMEJ publication. Throughout the year when members are not working on the publication, there will be weekly blog posts based on current events in medical ethics.",Group,https://dukegroups.com/DMEJ/,0,0,
252,Duke Medical Science Liaison Club,The mission of DMSLC is to educate its members about the career path and of a medical science liaison through presentations and networking with current MSLs in the field and other industry service positions.,Group,https://dukegroups.com/DMSLC/,0,0,
253,Duke's Neurodiversity Advocates,"To know about it, reach out to people from the reference link.",Group,https://dukegroups.com/DNA/,0,0,
254,Duke Nutrition Society,"The mission of Duke Nutrition Society is to engage students at Duke University with similar interests in nutrition and bring them together, through nutrition-related activities and social events.",Group,https://dukegroups.com/DNS/,0,0,
255,Duke Nurses for Sexual and Reproductive Health,"The purpose of this organization shall be to further the mission of Nurses for Sexual and Reproductive Health, a national organization, on the Duke University campus and to provide Duke University School of Nursing students with the education, tools, and resources necessary to become social-change agents within the healthcare system as it relates to sexual and reproductive justice.",Group,https://dukegroups.com/DNSRH/,0,0,
256,Duke Outreach in Genetics and Genomics,The mission of DOinGG is to educate the local community in genetics and genomics topics while providing opportunities to graduate students to improve teaching and communication skills.,Group,https://dukegroups.com/DOinGG/,0,0,
257,Duke Presidential Ambassadors,"Duke Presidential Ambassadors, previously known as Dukes and Duchesses, was established in 1979 as an organization of student ambassadors dedicated to serving Duke University. The members of the Duke Presidential Ambassadors provide a glimpse into the student experience for campus visitors. Responsibilities include leading campus tours, staffing special events, and assisting with university ceremonies. Some examples of special events include staffing the president’s suite at football games, receptions at the university president’s home, Board of Trustee dinners, and Opening and Founders’ Day Convocations.",Group,https://dukegroups.com/DPA/,0,0,
258,Diversity++,"Diversity++ is a club empowering Black, Indigenous, and Latinx students who are in computing. The club is a support system for people of color in computing. Not only for getting jobs or studying, but also for uplifting and helping each other be our best selves. We plan to work closely with other diversity organizations, like Colorstack, to help our mission.",Group,https://dukegroups.com/DPP/,0,0,
259,Duke Quantitative Trading,"The mission of DQT is to create a pre-professional community of students interested in pursuing a career in quantitative finance, algorithmic trading, and derivatives research. This organization aims not only to increase the momentum of quantitative finance at Duke but also aims to act as a resource for students interested in this career path. We hope to provide Duke students the opportunity to compete in trading competitions, network with prominent quant trading firms, and connect with the broader quantitative finance community. The organization will hold resume-building events, social bonding activities, and speaker series. For analyst positions, we will also provide weekly lectures in a training program, ranging from statistics, programming, asset classes, and trading strategies.",Group,https://dukegroups.com/DQT/,0,0,
260,Duke Roundnet Club,"The purpose of this Club is to provide an opportunity for students of Duke University to learn and play the sport of Spikeball in a friendly and competitive environment. Our goals are to set up open campus-wide tournaments to promote our club as well as the sport of Spikeball to anyone who is interested. We plan to represent Duke at other college campuses during intercollegiate tournaments across the nation. We will equip members with all they need to be a successful Spikeball Player. Our mission is to help further the knowledge of Spikeball across the City, State, and Nation, starting with Durham, NC.",Group,https://dukegroups.com/DRC/,1,0,
261,Duke Real Estate Club,"The Duke Real Estate Club seeks to educate its members about the vast industry of real estate and establish connections through networking opportunities. Our mission is to provide career development, educational events, mentorship, and workshops. We partner with Duke alumni to provide an experience that extends beyond the classroom and provides numerous opportunities to interact with prominent real estate professionals.",Group,https://dukegroups.com/DREC/,0,0,
262,Duke Drone Racing,The mission of Duke AMA is to create a space for students to explore the use of drones at Duke.,Group,https://dukegroups.com/Drone/,0,0,
