Column1,Name,Description,Type,Reference,Sports,Spiritual,
640,Judy & Caleb's Upperclassman Small Group,Religious/Spiritual,Events,https://dukegroups.com/rsvp?id=2172244,0,1,
641,Out of the Blue Rehearsal,"Student, A Capella",Events,https://dukegroups.com/rsvp?id=2174558,0,0,
642,dPS Fellows StudentU Volunteering,Student,Events,https://dukegroups.com/rsvp?id=2249956,0,0,
643,DSC Session at Hillside High School,Student,Events,https://dukegroups.com/rsvp?id=2203190,0,0,
644,DSC Session at Hillside High School,Student,Events,https://dukegroups.com/rsvp?id=2203201,0,0,
645,DukeLIFE Thanksgiving Dinner,"Multicultural/Identity, Free Food, Mindfulness, Undergraduate Students",Events,https://dukegroups.com/rsvp?id=2250585,0,0,
646,DUST Weekly Workshop,"Workshop/Short Course, Comedy, Destress, Free, Fun, Performance",Events,https://dukegroups.com/rsvp?id=2163197,0,0,
647,Duke Cyber Tech Track Meeting,Student,Events,https://dukegroups.com/rsvp?id=2203081,0,0,
648,Cru Weekly Meetings,"Religious/Spiritual, Community, Spritual/Religious",Events,https://dukegroups.com/rsvp?id=2180517,0,1,
649,Alexander Hamilton Society Abdullah Antepli Fellowship Meeting,Lecture/Talk,Events,https://dukegroups.com/rsvp?id=2250098,0,0,
650,SHAPE GBM,"Student, Activism",Events,https://dukegroups.com/rsvp?id=2194329,0,0,
651,dPS Fellows StudentU Volunteering,Student,Events,https://dukegroups.com/rsvp?id=2249958,0,0,
652,E-Social,Student,Events,https://dukegroups.com/rsvp?id=2172904,0,0,
653,Jackson Office Hours,Student,Events,https://dukegroups.com/rsvp?id=2240883,0,0,
654,Duke Quiz Bowl Practice,"Student, Fun",Events,https://dukegroups.com/rsvp?id=2175842,0,0,
655,Duke Quiz Bowl Practice,"Student, Fun",Events,https://dukegroups.com/rsvp?id=2175856,0,0,
656,Duke Quiz Bowl Practice,"Student, Fun",Events,https://dukegroups.com/rsvp?id=2175869,0,0,
657,Cristo Rey Tutoring,Student,Events,https://dukegroups.com/rsvp?id=2249754,0,0,
658,E-Social,Student,Events,https://dukegroups.com/rsvp?id=2172905,0,0,
659,Christians On Campus Sunday Gathering,Religious/Spiritual,Events,https://dukegroups.com/rsvp?id=2147623,0,1,
660,First Semester MMA Practice,"Health/Wellness, Sports",Events,https://dukegroups.com/rsvp?id=2174517,1,0,
661,Neurocare Student Outreach Meeting,Social,Events,https://dukegroups.com/rsvp?id=2227329,0,0,
662,Catalyst General Body Meeting,Student,Events,https://dukegroups.com/rsvp?id=2174978,0,0,
663,Moot Court GBMs,"Student, Debate, Law",Events,https://dukegroups.com/rsvp?id=2164365,0,0,
664,Investment Club GBM,Student,Events,https://dukegroups.com/rsvp?id=2154192,0,0,
665,Simple Charity Chapter Meeting,Religious/Spiritual,Events,https://dukegroups.com/rsvp?id=2226995,0,1,
666,FORM GBM Meetings,"Student, Art",Events,https://dukegroups.com/rsvp?id=2197252,0,0,
667,FORM GBM Meetings,"Student, Art",Events,https://dukegroups.com/rsvp?id=2202763,0,0,
668,TRC Practice,Social,Events,https://dukegroups.com/rsvp?id=2199793,0,0,
669,AKPsi Finance Bootcamp,Student,Events,https://dukegroups.com/rsvp?id=2250348,0,0,
670,Environmental Alliance GBM,"Student, Advocacy, Environment, Sustainability",Events,https://dukegroups.com/rsvp?id=2181376,0,0,
671,Environmental Alliance GBM,"Student, Advocacy, Environment, Sustainability",Events,https://dukegroups.com/rsvp?id=2181388,0,0,
672,Duke BioByte General Body Meeting,Social,Events,https://dukegroups.com/rsvp?id=2231861,0,0,
673,Investment Club ITP,Student,Events,https://dukegroups.com/rsvp?id=2193170,0,0,
674,BOW Exec Meeting,Student,Events,https://dukegroups.com/rsvp?id=2193153,0,0,
675,Duke Quiz Bowl Practice,"Student, Fun",Events,https://dukegroups.com/rsvp?id=2175829,0,0,
676,Simple Charity Chapter Meeting,Religious/Spiritual,Events,https://dukegroups.com/rsvp?id=2183524,0,1,
677,Dinner Church,"Student, Community, Cultural, Food, Free Food, LGBTQIA, Mindfulness, Religious, Spritual/Religious, Wellness - Spiritual",Events,https://dukegroups.com/rsvp?id=2250211,0,1,
678,Duke STEM Connect GBM,"Student, Education, STEM",Events,https://dukegroups.com/rsvp?id=2204880,0,0,
679,Social Security Drop-Offs,"Social, Caribbean, Graduate Students, International Students, Undergraduate Students",Events,https://dukegroups.com/rsvp?id=2169828,0,0,
680,Cristo Rey Tutoring,Student,Events,https://dukegroups.com/rsvp?id=2249755,0,0,
681,Hatha Yoga in the Wellness Center,"Health/Wellness, DuWell, Mindfulness, Moments of Mindfulness, Wellness - Mind-Body",Events,https://dukegroups.com/rsvp?id=2135447,0,0,
682,Hatha Yoga in the Wellness Center,"Health/Wellness, DuWell, Mindfulness, Moments of Mindfulness, Wellness - Mind-Body",Events,https://dukegroups.com/rsvp?id=2135457,0,0,
683,Sydney and Angelica Midweek,Student,Events,https://dukegroups.com/rsvp?id=2224081,0,0,
684,Crafting in the Wellness Center,"Health/Wellness, Craftsmanship, DuWell, Mindfulness, Moments of Mindfulness",Events,https://dukegroups.com/rsvp?id=2138090,0,0,
685,"""Still Alice"" Screening In Anticipation of NeuroCare's Talk w/ Author Dr. Lisa Genova!","Social, Health/Wellness, Literature, Movie, Pre-Med, Science Journalism, STEM, Wellness - Mind-Body",Events,https://dukegroups.com/rsvp?id=2250572,0,0,
686,SPARK Conversation on Cultivating Meaningful Mentorship,"Workshop/Short Course, Academic Advising Center, Advising, Class of 2025, Class of 2026, Education, Free Food, Hidden Curriculum, Research, Sophomore Year Experience, Sophomores, Support and Resources, Undergraduate Students",Events,https://dukegroups.com/rsvp?id=2250403,0,0,
687,Turquoise Beading Night,"Multicultural/Identity, Art, Native American Heritage Month, Native American Sorority",Events,https://dukegroups.com/rsvp?id=2250510,0,0,
688,Cru Freshmen Girls Life Group,"Religious/Spiritual, Community, Religious, Social",Events,https://dukegroups.com/rsvp?id=2182682,0,1,
689,Stitch & Sip: Café Crochet,"Multicultural/Identity, Art, Latinx",Events,https://dukegroups.com/rsvp?id=2250442,0,0,
690,Figure Drawing Workshop,"DUU, DUU, VisArts",Events,https://dukegroups.com/rsvp?id=2136633,0,0,
691,Let's Talk about Israel,"Lecture/Talk, Education, Israel",Events,https://dukegroups.com/rsvp?id=2250147,0,0,
692,GlobeMed GBM,Student,Events,https://dukegroups.com/rsvp?id=2166285,0,0,
693,GlobeMed GBM,"Health/Wellness, Global Health, Pre-Med, STEM, Volunteer",Events,https://dukegroups.com/rsvp?id=2187145,0,0,
694,Little Shop of Horrors: Rehearsals,"Student, Musical",Events,https://dukegroups.com/rsvp?id=2250501,0,0,
695,Duke Drone Racing Meeting,"Student, Community, Engineering, Recreation/Competition, STEM, Technology",Events,https://dukegroups.com/rsvp?id=2213598,0,0,
696,Judy & Caleb's Upperclassman Small Group,Religious/Spiritual,Events,https://dukegroups.com/rsvp?id=2172245,0,1,
697,Out of the Blue Rehearsal,"Student, A Capella",Events,https://dukegroups.com/rsvp?id=2174559,0,0,
698,Fajr Breakfast Club,"Religious/Spiritual, CML, Muslim",Events,https://dukegroups.com/rsvp?id=2147479,0,1,
699,Virtual Election,Panel/Seminar/Colloqium,Events,https://dukegroups.com/rsvp?id=2250460,0,0,
700,dPS Fellows StudentU Volunteering,Student,Events,https://dukegroups.com/rsvp?id=2249959,0,0,
701,Birding for Mindfulness,"Health/Wellness, DuWell, Mindfulness, Moments of Mindfulness, Wellness - Environmental",Events,https://dukegroups.com/rsvp?id=2137291,0,0,
702,Climate Conchas,"Student, Cultural, Environment",Events,https://dukegroups.com/rsvp?id=2250415,0,0,
703,Camp Kesem Giving Tuesday Event,"Student, Service",Events,https://dukegroups.com/rsvp?id=2249780,0,0,
704,DMSLC: November 28 Meeting HYBRID,"Lecture/Talk, Free Food",Events,https://dukegroups.com/rsvp?id=2250140,0,0,
705,Meditative Art in the Wellness Center,"Health/Wellness, Art, DuWell, Mindfulness, Moments of Mindfulness, Wellness, Wellness - Mind-Body",Events,https://dukegroups.com/rsvp?id=2133745,0,0,
706,Knitting Circle,"DUU, Art, DUU, Free, Relaxation",Events,https://dukegroups.com/rsvp?id=2250464,0,0,
707,Meditation Practices in the Wellness Center,"Health/Wellness, DuWell, Meditation, Mindfulness, Moments of Mindfulness",Events,https://dukegroups.com/rsvp?id=2137278,0,0,
708,Meditation Practices in the Wellness Center,"Health/Wellness, DuWell, Meditation, Mindfulness, Moments of Mindfulness",Events,https://dukegroups.com/rsvp?id=2138076,0,0,
709,Global Conversations in The Wellness Center,"Health/Wellness, DuWell, Health/Wellness, Moments of Mindfulness, Wellness, Wellness - Social",Events,https://dukegroups.com/rsvp?id=2106643,0,0,
710,Global Conversations in the Wellness Center,"Lecture/Talk, Moments of Mindfulness",Events,https://dukegroups.com/rsvp?id=2135790,0,0,
711,DSC Session at Hillside High School,Student,Events,https://dukegroups.com/rsvp?id=2203191,0,0,
712,DSC Session at Hillside High School,Student,Events,https://dukegroups.com/rsvp?id=2203202,0,0,
713,DSC Session at Hillside High School,Student,Events,https://dukegroups.com/rsvp?id=2203213,0,0,
714,Arts Annex Open Hours,"Student, Art",Events,https://dukegroups.com/rsvp?id=2250392,0,0,
715,Restorative Yoga in the Wellness Center,"Health/Wellness, DuWell, Mindfulness, Moments of Mindfulness, Restorative, Wellness - Mind-Body",Events,https://dukegroups.com/rsvp?id=2135434,0,0,
716,Kesem Giving Tuesday Recruitment & Outreach!,Student,Events,https://dukegroups.com/rsvp?id=2232793,0,0,
717,Elliot Wong Speaker Event,Lecture/Talk,Events,https://dukegroups.com/rsvp?id=2248628,0,0,
718,Hurston-James Society November Get Together,"Social, BIPOC",Events,https://dukegroups.com/rsvp?id=2250609,0,0,
719,Essay Review w/ Mi Gente,"Student, Advising, Community, Cultural, Service, Writing",Events,https://dukegroups.com/rsvp?id=2250516,0,0,
720,KitabConnect HYBRID,"Religious/Spiritual, Muslim",Events,https://dukegroups.com/rsvp?id=2147443,0,1,
721,Screen-Printing,Workshop/Short Course,Events,https://dukegroups.com/rsvp?id=2250290,0,0,
722,"Guest Speaker: Dr. Arthur Laffer, ""The Father of Supply Side Economics""","Lecture/Talk, Policy, Politics",Events,https://dukegroups.com/rsvp?id=2153903,0,0,
723,Presentation by Maggie Sauer,Student,Events,https://dukegroups.com/rsvp?id=2250568,0,0,
724,Best Buddies Thanksgiving Party,Social,Events,https://dukegroups.com/rsvp?id=2249054,0,0,
725,MAPS Primary Care Panel,"Panel/Seminar/Colloqium, Health/Wellness, Medicine, Pre-Med",Events,https://dukegroups.com/rsvp?id=2250115,0,0,
726,DQF Bootcamp,Workshop/Short Course,Events,https://dukegroups.com/rsvp?id=2248518,0,0,
727,Pre-Dental Society- GBM,Student,Events,https://dukegroups.com/rsvp?id=2194470,0,0,
728,Little Shop of Horrors: Rehearsals,"Student, Musical",Events,https://dukegroups.com/rsvp?id=2250502,0,0,
729,Duke LBO General Body Meeting,Multicultural/Identity,Events,https://dukegroups.com/rsvp?id=2218849,0,0,
730,Pieces of Me,Multicultural/Identity,Events,https://dukegroups.com/rsvp?id=2220778,0,0,
731,Naomie & Austin's Freshman Small Group,Religious/Spiritual,Events,https://dukegroups.com/rsvp?id=2171931,0,1,
732,RUF Large Group,"Religious/Spiritual, Religious, Spritual/Religious",Events,https://dukegroups.com/rsvp?id=2134180,0,1,
733,WiT Weekly Meetings,Student,Events,https://dukegroups.com/rsvp?id=2176398,0,0,
734,Duke Cyber Policy Track Meeting,Student,Events,https://dukegroups.com/rsvp?id=2199344,0,0,
735,Stargazing Devils Exec Meeting,Panel/Seminar/Colloqium,Events,https://dukegroups.com/rsvp?id=2234399,0,0,
736,APiO/LUL/LTA Packing Party,"Multicultural/Identity, Community, Greek Life, Service",Events,https://dukegroups.com/rsvp?id=2250678,0,0,
737,Fajr Breakfast Club,"Religious/Spiritual, CML, Muslim",Events,https://dukegroups.com/rsvp?id=2147480,0,1,
738,dPS Fellows StudentU Volunteering,Student,Events,https://dukegroups.com/rsvp?id=2249960,0,0,
739,DSC Session at Rogers-Herr Middle School,Student,Events,https://dukegroups.com/rsvp?id=2203224,0,0,
740,Pronoun Primer Training,"Workshop/Short Course, CSGD, LGBTQIA",Events,https://dukegroups.com/rsvp?id=2138557,0,0,
741,TeaGather with CommuniTEA,"Health/Wellness, DuWell, Mindfulness, Moments of Mindfulness, Wellness - Social",Events,https://dukegroups.com/rsvp?id=2136032,0,0,
742,DSC Session at Durham School of Technology After School Club,Student,Events,https://dukegroups.com/rsvp?id=2203241,0,0,
743,Arts Annex Open Hours,"Student, Art",Events,https://dukegroups.com/rsvp?id=2250393,0,0,
744,Cat Tales Cat Cafe Visit,"Student, Animals, Community, Education, Information Session",Events,https://dukegroups.com/rsvp?id=2250375,0,0,
745,Redefining Leadership - Next Level Leadership,"Workshop/Short Course, Next Level Leadership",Events,https://dukegroups.com/rsvp?id=2237652,0,0,
746,DuWell Paint Night in the Student Wellness Center,"Health/Wellness, Moments of Mindfulness",Events,https://dukegroups.com/rsvp?id=2137298,0,0,
747,Sister's Halaqa,Religious/Spiritual,Events,https://dukegroups.com/rsvp?id=2250085,0,1,
748,Two-Spirit: Film Screening,"Multicultural/Identity, BIPOC, CMA, CSGD, Cultural, Food, LGBTQIA, Movie, Native American Heritage Month",Events,https://dukegroups.com/rsvp?id=2250457,0,0,
749,PIHE GBM,Student,Events,https://dukegroups.com/rsvp?id=2196222,0,0,
750,Knitting in the Student Wellness Center Oasis,"Health/Wellness, Craftsmanship, DuWell, Mindfulness, Moments of Mindfulness, Wellness - Mind-Body, Wellness - Social",Events,https://dukegroups.com/rsvp?id=2135973,0,0,
751,Botanical Gel Printing,"Workshop/Short Course, Art, DukeCreate",Events,https://dukegroups.com/rsvp?id=2250291,0,0,
752,Drum Circle in the Wellness Center,"Health/Wellness, DuWell, Mindfulness, Moments of Mindfulness, Wellness - Mind-Body",Events,https://dukegroups.com/rsvp?id=2135804,0,0,
753,Help Desk Seminar with Katie Huber from Duke Margolis,Lecture/Talk,Events,https://dukegroups.com/rsvp?id=2215558,0,0,
754,Duke Cru Worship Night,Religious/Spiritual,Events,https://dukegroups.com/rsvp?id=2241586,0,1,
755,Duke Climate Coalition GBM,"Student, Environment",Events,https://dukegroups.com/rsvp?id=2192083,0,0,
756,DEID GBM #3,Student,Events,https://dukegroups.com/rsvp?id=2250459,0,0,
757,dPS Fellowship Meeting,"Student, Activism, Advocacy, Volunteer",Events,https://dukegroups.com/rsvp?id=2154144,0,0,
758,Little Shop of Horrors: Rehearsals,"Student, Musical",Events,https://dukegroups.com/rsvp?id=2250503,0,0,
759,Paint Night on East Campus,"Health/Wellness, Art, DuWell, Mindfulness, Moments of Mindfulness, Painting, Wellness",Events,https://dukegroups.com/rsvp?id=2217307,0,0,
760,DUST Weekly Workshop,"Workshop/Short Course, Comedy, Destress, Free, Fun, Performance",Events,https://dukegroups.com/rsvp?id=2163198,0,0,
761,Duke Cyber Tech Track Meeting,Student,Events,https://dukegroups.com/rsvp?id=2203082,0,0,
762,Duke RAM: Holiday Social + December GBM,Student,Events,https://dukegroups.com/rsvp?id=2250149,0,0,
763,Arizona Watch Party,House/Quad Council,Events,https://dukegroups.com/rsvp?id=2250657,0,0,
764,"Allen, Ann, Daniel & Lucy's Upperclassman Small Group",Religious/Spiritual,Events,https://dukegroups.com/rsvp?id=2170967,0,1,
765,DSG Senate,Student,Events,https://dukegroups.com/rsvp?id=2148662,0,0,
766,Cru Weekly Meetings,"Religious/Spiritual, Community, Spritual/Religious",Events,https://dukegroups.com/rsvp?id=2180518,0,1,
767,Technical Workshop,Workshop/Short Course,Events,https://dukegroups.com/rsvp?id=2248641,0,0,
768,PCM+ Bible Study,"Religious/Spiritual, Religious",Events,https://dukegroups.com/rsvp?id=2179459,0,1,
769,Alexander Hamilton Society GBM,"Student, Foreign Policy",Events,https://dukegroups.com/rsvp?id=2213708,0,0,
770,Jazz@ The Mary Lou @Krafthouse,"DUU, DUU, Music",Events,https://dukegroups.com/rsvp?id=2178349,0,0,
771,dPS Fellows StudentU Volunteering,Student,Events,https://dukegroups.com/rsvp?id=2249961,0,0,
772,Christians On Campus Sunday Gathering,Religious/Spiritual,Events,https://dukegroups.com/rsvp?id=2147624,0,1,
773,Large group,Religious/Spiritual,Events,https://dukegroups.com/rsvp?id=2175616,0,1,
774,OUF Accessible Mobility Advocacy Meeting,"Student, Urban Studies",Events,https://dukegroups.com/rsvp?id=2250160,0,0,
775,Basketball Watch party,House/Quad Council,Events,https://dukegroups.com/rsvp?id=2250658,0,0,
776,Guided Meditation in the Wellness Center,"Health/Wellness, DuWell, Meditation, Mindfulness, Moments of Mindfulness",Events,https://dukegroups.com/rsvp?id=2136007,0,0,
777,Arts Annex Open Hours,"Student, Art",Events,https://dukegroups.com/rsvp?id=2250396,0,0,
778,E-Social,Student,Events,https://dukegroups.com/rsvp?id=2172907,0,0,
779,Duke in Oxford Summer 2024 Info Session,"Lecture/Talk, Study Abroad",Events,https://dukegroups.com/rsvp?id=2250378,0,0,
780,Restorative Yoga in the Wellness Center,"Health/Wellness, DuWell, Mindfulness, Moments of Mindfulness, Restorative, Wellness - Mind-Body",Events,https://dukegroups.com/rsvp?id=2146477,0,0,
781,Camp Kesem Winter Crafting Event,Student,Events,https://dukegroups.com/rsvp?id=2250684,0,0,
782,Gift of Gathering: Honoring Immigrant Journeys with Thanks,"Multicultural/Identity, Immigrant Advocacy",Events,https://dukegroups.com/rsvp?id=2250577,0,0,
783,Noche de Adornos: First Year Ornament Night,"Social, Art, BIPOC, Craftsmanship, First Year Experience, Food, Free Food, Latin American and Caribbean, Latinx, Movie, Social, Wellness",Events,https://dukegroups.com/rsvp?id=2250032,0,0,
784,Sleight of Hand in the Student Wellness Center Oasis,"Health/Wellness, DuWell, Mindfulness, Moments of Mindfulness, Wellness - Social",Events,https://dukegroups.com/rsvp?id=2135990,0,0,
785,Dinner and Discussions Workshop: The Red Justice Project,"Workshop/Short Course, Advocacy, Free Food, Gender Violence Prevention, Human Rights, Native American Heritage Month, Women's Center",Events,https://dukegroups.com/rsvp?id=2249890,0,0,
786,Portrait Painting,"Workshop/Short Course, Art, DukeCreate",Events,https://dukegroups.com/rsvp?id=2250292,0,0,
787,BWU X Collegiate 100 Black Men Game Night,Social,Events,https://dukegroups.com/rsvp?id=2250244,0,0,
788,CMA First Friday Breakfast,"Social, CMA, Cultural, Free Food, Social",Events,https://dukegroups.com/rsvp?id=2140522,0,0,
789,Global Cafe,"Social, Environment, Graduate Students, Social, Undergraduate Students, Wellness",Events,https://dukegroups.com/rsvp?id=2237531,0,0,
790,Cristo Rey Tutoring,Student,Events,https://dukegroups.com/rsvp?id=2249756,0,0,
791,Vinyasa Yoga,"Health/Wellness, DuWell, Mindfulness, Moments of Mindfulness, Wellness - Mind-Body",Events,https://dukegroups.com/rsvp?id=2154033,0,0,
792,First Friday,"Student, Black, Faculty, Food, Graduate Students, Mary Lou Williams Center, Professional Students, Undergraduate Students",Events,https://dukegroups.com/rsvp?id=2216500,0,0,
793,Weekly Jumu'ah Service HYBRID,"Religious/Spiritual, CML, Muslim",Events,https://dukegroups.com/rsvp?id=2143636,0,1,
794,Global Grocery: Li Ming's Global Mart,"Health/Wellness, Food, Free, Graduate Students, International Students, Undergraduate Students",Events,https://dukegroups.com/rsvp?id=2147511,0,0,
795,TedXDuke Speaker Auditions,Student,Events,https://dukegroups.com/rsvp?id=2250352,0,0,
796,Karaoke Kickback,"Social, Community, CSGD, LGBTQIA, Moments of Mindfulness, Social",Events,https://dukegroups.com/rsvp?id=2250185,0,0,
797,Dance Class at Emily K Center,"Workshop/Short Course, Dance, Volunteer",Events,https://dukegroups.com/rsvp?id=2199410,0,0,
798,Open Pickleball Practice [Hosted by Duke Club Pickleball],"Social, Community, Fun, Health/Wellness, Recreation/Competition, Social",Events,https://dukegroups.com/rsvp?id=2248583,0,0,
799,Arts Annex Open Hours,"Student, Art",Events,https://dukegroups.com/rsvp?id=2250398,0,0,
800,E-Social,Student,Events,https://dukegroups.com/rsvp?id=2172908,0,0,
801,SantaPaws (Mi Gente x Duke Paws),"Health/Wellness, Animals, BIPOC, Health/Wellness, Latinx, Wellness",Events,https://dukegroups.com/rsvp?id=2250357,0,0,
802,Semi-Annual Powerpoint Night,Religious/Spiritual,Events,https://dukegroups.com/rsvp?id=2250253,0,1,
803,Shabbat with Jewish Life at Duke,"Religious/Spiritual, Free Food, Jewish, Religious",Events,https://dukegroups.com/rsvp?id=2235684,0,1,
804,Devils en Pointe Presents the Nutcracker!,"Student, Ballet, Dance, Free",Events,https://dukegroups.com/rsvp?id=2250059,0,0,
805,Duke Diya Awaaz 2023,Concert/Music,Events,https://dukegroups.com/rsvp?id=2211724,0,0,
806,Little Big Show,"Concert/Music, Comedy",Events,https://dukegroups.com/rsvp?id=2249888,0,0,
807,Friday Stargazing Open House,Student,Events,https://dukegroups.com/rsvp?id=2154360,0,0,
808,NSBE Holiday Lock-In,Social,Events,https://dukegroups.com/rsvp?id=2250556,0,0,
809,dPS Outing 3: Root Causes,"Student, Service, Volunteer",Events,https://dukegroups.com/rsvp?id=2250588,0,0,
810,Duke Cru Worship Morning,Religious/Spiritual,Events,https://dukegroups.com/rsvp?id=2250695,0,1,
811,TedXDuke Speaker Auditions,Student,Events,https://dukegroups.com/rsvp?id=2250354,0,0,
812,Arts Annex Open Hours,"Student, Art",Events,https://dukegroups.com/rsvp?id=2250399,0,0,
813,Volunteer Shelter Trips,"Student, Animals, Volunteer",Events,https://dukegroups.com/rsvp?id=2229242,0,0,
814,Little Shop of Horrors: Rehearsals,"Student, Musical",Events,https://dukegroups.com/rsvp?id=2250509,0,0,
815,Mi Gente Journaling Workshop,"Health/Wellness, Latinx, MentalHealth, Self Care, Wellness",Events,https://dukegroups.com/rsvp?id=2250358,0,0,
816,Durham Rescue Mission Dinner,Religious/Spiritual,Events,https://dukegroups.com/rsvp?id=2229926,0,1,
817,Frosty Fest,"DUU, Free Food, Fun, Holiday",Events,https://dukegroups.com/rsvp?id=2250176,0,0,
818,Vertices Winter Social,Social,Events,https://dukegroups.com/rsvp?id=2250407,0,0,
819,TASA Hotpot Night,Multicultural/Identity,Events,https://dukegroups.com/rsvp?id=2250590,0,0,
820,Game Night,"Social, Games",Events,https://dukegroups.com/rsvp?id=2250693,0,0,
821,United in Praise Winter Concert,"Concert/Music, Black, Choir, Mary Lou Williams Center, Music, Singing",Events,https://dukegroups.com/rsvp?id=2178381,0,0,
822,Devils After Dark: Finals Fuel Grocery Bingo,"Social, Free, Free Food, Fun, Games",Events,https://dukegroups.com/rsvp?id=2249920,0,0,
823,Devils en Pointe Presents the Nutcracker!,"Student, Ballet, Dance, Free",Events,https://dukegroups.com/rsvp?id=2250067,0,0,
824,Duke Diya Awaaz 2023,Concert/Music,Events,https://dukegroups.com/rsvp?id=2211725,0,0,
825,Holiday Cabaret,"Social, Community, Entertainment, Free, Free Food, Fun, Musical, Theatre",Events,https://dukegroups.com/rsvp?id=2250573,0,0,
826,Christians On Campus Sunday Gathering,Religious/Spiritual,Events,https://dukegroups.com/rsvp?id=2147625,0,1,
827,First Semester MMA Practice,"Health/Wellness, Sports",Events,https://dukegroups.com/rsvp?id=2174518,0,0,
828,Weekly Sunday Bagel Brunch,"Social, Food, Free Food, Jewish",Events,https://dukegroups.com/rsvp?id=2182270,1,0,
829,BRUNCHANE,"House/Quad Council, Entertainment, Food, Self Care, Social",Events,https://dukegroups.com/rsvp?id=2230879,0,0,
830,BRUNCHANE,"House/Quad Council, Entertainment, Food, Self Care, Social",Events,https://dukegroups.com/rsvp?id=2230889,0,0,
831,Neurocare Student Outreach Meeting,Social,Events,https://dukegroups.com/rsvp?id=2227330,0,0,
832,Arts Annex Open Hours,"Student, Art",Events,https://dukegroups.com/rsvp?id=2250400,0,0,
833,Duke Amnesty International Meeting,"Student, Activism, Advocacy, Human Rights",Events,https://dukegroups.com/rsvp?id=2201651,0,0,
834,DIFF/ Duke Film Club GBM,"Student, Art, Film, Mixed Media, Movie, Student",Events,https://dukegroups.com/rsvp?id=2213477,0,0,
835,Moot Court GBMs,"Student, Debate, Law",Events,https://dukegroups.com/rsvp?id=2164366,0,0,
836,Motorsports Annual Go-Karting Social,Social,Events,https://dukegroups.com/rsvp?id=2250581,0,0,
837,Last in the Class Performance,"Concert/Music, Art, Entertainment, Free, Music, Musical, Performance, Singing, Theatre",Events,https://dukegroups.com/rsvp?id=2242687,0,0,
838,NPHC General Body Meeting,"Student, Black, Greek Life",Events,https://dukegroups.com/rsvp?id=2210657,0,0,
839,Investment Club GBM,Student,Events,https://dukegroups.com/rsvp?id=2154193,0,0,
840,Body Banter (Body Empowerment Project) GBM,"Lecture/Talk, MentalHealth",Events,https://dukegroups.com/rsvp?id=2250550,0,0,
841,Simple Charity Chapter Meeting,Religious/Spiritual,Events,https://dukegroups.com/rsvp?id=2226996,0,1,
842,FORM GBM Meetings,"Student, Art",Events,https://dukegroups.com/rsvp?id=2197253,0,0,
843,FORM GBM Meetings,"Student, Art",Events,https://dukegroups.com/rsvp?id=2202764,0,0,
844,TRC Practice,Social,Events,https://dukegroups.com/rsvp?id=2199794,0,0,
845,Environmental Alliance GBM,"Student, Advocacy, Environment, Sustainability",Events,https://dukegroups.com/rsvp?id=2181378,0,0,
846,Environmental Alliance GBM,"Student, Advocacy, Environment, Sustainability",Events,https://dukegroups.com/rsvp?id=2181389,0,0,
847,Duke BioByte General Body Meeting,Social,Events,https://dukegroups.com/rsvp?id=2231862,0,0,
848,Investment Club ITP,Student,Events,https://dukegroups.com/rsvp?id=2193171,0,0,
849,Puppy Playtime with Duke Paws,"Health/Wellness, Animals, DuWell, Mindfulness, Moments of Mindfulness, Service, Wellness",Events,https://dukegroups.com/rsvp?id=2234457,0,0,
850,Student Leadership Brunch,Social,Events,https://dukegroups.com/rsvp?id=2250320,0,0,
851,Duke Quiz Bowl Practice,"Student, Fun",Events,https://dukegroups.com/rsvp?id=2175830,0,0,
852,Simple Charity Chapter Meeting,Religious/Spiritual,Events,https://dukegroups.com/rsvp?id=2183525,0,1,
853,Dinner Church,"Student, Community, Cultural, Food, Free Food, LGBTQIA, Mindfulness, Religious, Spritual/Religious, Wellness - Spiritual",Events,https://dukegroups.com/rsvp?id=2250212,0,1,
854,Duke STEM Connect GBM,"Student, Education, STEM",Events,https://dukegroups.com/rsvp?id=2204881,0,0,
855,DSC Session at Lowe's Grove,Student,Events,https://dukegroups.com/rsvp?id=2203179,0,0,
