Column1,Name,Description,Type,Reference,Sports,Spiritual,
413,Pocket Musician,"Pocket Musician aims to engage, interact, and cultivate relationships with seniors at senior homes throughout the US through both live video conferences and specially catered recorded musical performances.",Group,https://dukegroups.com/PKN/,0,0,
414,Policy in Living Color,"To know about it, reach out to people from the reference link.",Group,https://dukegroups.com/PLC/,0,0,
415,The Poetea Club,"To know about it, reach out to people from the reference link.",Group,https://dukegroups.com/Poetea/,0,0,
416,Policy for the People,"Policy for the People is an organization built around equity, activism, organizing, and progressive ideals. Our mission is to help teach how to successfully turn policy ideas into action by bringing organizing trainings to Duke students, providing DEIA trainings to Duke students, fostering relationships with local and communication organizations, and building skills necessary for action-oriented policy work.",Group,https://dukegroups.com/PolicyforPeople/,0,0,
417,Duke PorColombia,"Duke PorColombia seeks to unite students of Colombian heritage and students interested in learning about Colombia. Through various social, cultural, and philanthropic events and initiatives, our goal is to build, support and represent the Colombian student community at Duke University.",Group,https://dukegroups.com/PorColombia/,0,0,
418,Progress. Period.,"PERIOD. strives to eradicate period poverty and stigma through service, education, and advocacy. Through the distribution of menstrual products and championing of menstrual equity in policy, PERIOD. aims to center those disproportionately affected by period poverty and support local efforts for menstrual equity.",Group,https://dukegroups.com/PP/,0,0,
419,Planned Parenthood Generation Action Duke,"The mission of PPGAD is to organize public events, educate, support local Planned Parenthood health centers, and mobilize students and other young people to speak out for reproductive rights and access to reproductive health services.",Group,https://dukegroups.com/PPGAD/,0,0,
420,Duke Public Policy Majors' Union,"The Public Policy Majors' Union is the official organization representing undergraduates at the Sanford School. Led by students, the Majors Union engages students in the life of the Sanford School and provides opportunities to learn and network outside of the classroom.",Group,https://dukegroups.com/PPMU/,0,0,
421,Pratt School of Engineering,"To know about it, reach out to people from the reference link.",Group,https://dukegroups.com/pratt/,0,0,
422,Project HEAL: Health Equity and Awareness in Latinx Communities,"The mission of Project HEAL is to implement and conduct service projects in Latin America and Durham with the goal of reducing global health disparities, particularly those of child and maternal health, through education and empowerment. We value sustainable development and preventative measures that aim to improve community health and help bridge the gap between Duke and Durham. Members of Project HEAL will collaborate with other student groups and community partners to coordinate effective health education projects in Honduras and in Durham. In the future, we hope that our health education and capacity-training efforts can be sustainable within the communities that we serve.",Group,https://dukegroups.com/ProjectHEAL/,0,0,
423,Pakistani Students Association,"The mission of PSA is âto provide a platform for Pakistani and non-Pakistani students alike to connect with the country's rich culture, engage with the issues facing it, and form a network of support and community for all those who associate with it. PSA seeks to accomplish this mission by having several events, such as a speaker series (where we would like to invite prominent people connected with Pakistani culture to speak on campus), cricket games, board game nights, etc.â",Group,https://dukegroups.com/PSA/,0,0,
424,Psi Upsilon,The mission of the Psi Upsilon Fraternity is to provide its members with:,Group,https://dukegroups.com/PsiU/,0,0,
425,Pureun,"Started in 2018, Pureun is a Kpop-focused dance group at Duke. Pureun aims to create an avenue for those interested in Kpop and represent Korean pop-culture to the Duke and North Carolina community. We cover dances to all music genres within the South Korean music industry, including R&amp;B, pop, ballad, and more. As a culture group, we strive to include people from all cultural and social backgrounds and celebrate our love for music and dance.",Group,https://dukegroups.com/Pureun/,0,0,
426,President's Quad Cup,"To know about it, reach out to people from the reference link.",Group,https://dukegroups.com/QuadCup/,0,0,
427,Robotics and Diving Club,The goal of the Robotics and Diving club (RAD) is to provide Duke students and faculty the opportunity to pursue scuba diving as an interdisciplinary method to explore environmental passions and engineering.,Group,https://dukegroups.com/RAD/,0,0,
428,Duke Remote Area Medical,"Remote Area Medical (RAM) is a national nonprofit that provides free popup medical/dental clinics in underserved communities. The Duke chapter of Remote Area Medical will support RAM using a three-pronged approach encompassing service, education, and advocacy.",Group,https://dukegroups.com/RAM/,0,0,
429,Randolph House Council,"To know about it, reach out to people from the reference link.",Group,https://dukegroups.com/Randolph/,0,0,
430,Duke Student-led Rare Cancer Consortium,"To know about it, reach out to people from the reference link.",Group,https://dukegroups.com/Rare2Care/,0,0,
431,Root Causes Undergraduate Coalition,"The mission of Duke RCUC is to assist in the operations of Root Causes, a community organization",Group,https://dukegroups.com/RCUC/,0,0,
432,DUSON Research Club,"The purpose of the DUSON Research Club is to empower nursing students to engage in research and evidence-based practice (EBP) through participating in research, conducting research, and discussing new research. We strive to source and create opportunities for nursing students to collaborate with faculty and other students in research at DUSON and/or other Duke programs. We also aim to provide nursing students with opportunities to present their research and receive recognition for their scholarly contributions.",Group,https://dukegroups.com/ResearchClub/,0,0,
433,Runway of Dreams at Duke,"Runway of Dreams at Duke will provide an interdisciplinary space to empower people with disabilities on the runway and to advance the future of adaptive design and innovation through a variety of design workshops, fundraising events, and runway shows.",Group,https://dukegroups.com/RODatDuke/,0,0,
434,Rotaract Club of Duke University,"The mission of Rotaract is to provide an opportunity for young adults to enhance the knowledge and skills that will assist them in personal development, to address the physical and social needs of their communities, and to promote better relations between all people worldwide through a framework of friendship and service.",Group,https://dukegroups.com/Rotaract/,0,0,
435,Club Rugby,To dominate the competition and contribute to spreading rugby in the USA!,Group,https://dukegroups.com/Rugby/,1,0,
436,Sanford Academic Committee,"To know about it, reach out to people from the reference link.",Group,https://dukegroups.com/SAC/,0,0,
437,Student Affairs Staff Resource Office,"We are possibility thinkers, talent developers, and creative strategists. We partner with you to tell the story of Student Affairs and foster a culture of team learning and continuous growth. We are here to cultivate collaboration and spark creativity.",Group,https://dukegroups.com/SAHR/,0,0,
438,Sanford Pride,"PridePol exists to provide space and opportunities for the LGBTQIA+ community at Sanford to come together in coalition and power. The organization aims to amplify and support the efforts of queer individuals, events, and issues on the Duke campus, within the Durham community, and beyond. In addition, PridePol facilitates opportunities for Sanford students to learn about and advance policies affecting the queer community and our intersectional allies.",Group,https://dukegroups.com/SanfordPride/,0,0,
439,Sanford Social Committee,"To know about it, reach out to people from the reference link.",Group,https://dukegroups.com/SanfordSoComm%20/,0,0,
440,Duke Sangeet,"The mission of Sangeet is to nurture South Asian classical music and present an immersion experience to the Duke University community in both its student and faculty bodies. Sangeet seeks to accomplish this mission by fostering community and collaboration between classical musicians and appreciators in the community, encouraging and supporting musicians on campus to showcase their talent on campus, hosting performances and concerts given by local musicians as well as musicians from India who shall travel abroad to present their art form, presenting lecture demonstrations and workshops that complement these concerts and allow audience members to see, hear, and even touch the instruments being showcased for educative and entertaining value.",Group,https://dukegroups.com/Sangeet/,0,0,
441,Shave and Buzz at Duke University,"The purpose of this organization is to support the I’m Not Done Yet Foundation in raising money for AYA cancer research. To do so, the organization will hold an annual shave in the Spring of each semester where the proceeds will go directly towards AYA cancer research and programs which the I’m Not Done Yet Foundation supports (nearly all programs are run in conjunction with the Duke Hospital). The fundraiser will consist of members volunteering to get their heads shaved to promote cancer awareness, as well as soliciting donations in the weeks leading up to the shave. We also plan to hold an auction coinciding with the event as another avenue to generate donations.",Group,https://dukegroups.com/SBDU/,0,0,
442,Scoop,Scoop is a sustainability group serving to turn passion for our planet into action. We work to facilitate connections between groups of Duke students and sustainable businesses. These small teams of students will receive trainings through Scoop and their outside organization partner to successfully work on a semester-long project. We serve to recruit small teams composed of motivated and passionate students eager to help make an environmental impact while gaining sustainable business experience.,Group,https://dukegroups.com/ScoopDuke/,0,0,
443,Society of Duke Fellows,"SDF aims to foster discourse across the disciplines at the University through discussion groups, invited lectures, and research presentations. In doing so, the Society hopes to enrich the intellectual experience of both its own members and the whole Graduate Community at Duke.",Group,https://dukegroups.com/SDF/,0,0,
444,Sanford Energy and Environment Club,"Sanford Energy and Environment Club (SEEC) provides a space for students interested in energy/environmental policy to share knowledge and ideas with each other, as well as network with industry professionals. SEEC hosts social events to facilitate conversations about climate change, the energy transition, and much more. Our goal is to connect students with fresh ideas, job opportunities, and leaders in the energy and environment community.",Group,https://dukegroups.com/SEEC/,0,0,
445,Sexual Harassment and Assault Prevention & Education,"SHAPE is a student advocacy organization working to eradicate sexual violence through prevention, education, and response efforts at Duke. We want to see the day where Duke doesn’t need SHAPE. Until then, SHAPE will be on the frontline igniting cultural and institutional, survivor-centric change.",Group,https://dukegroups.com/SHAPE/,0,0,
446,Siren Music Community,"All interested students will have free access to a variety of extra-curricular music learning resources, such as music workshops, small-group instrumental lessons, songwriting and composition critique circles, student mentors, and speaker events from visiting artists. Students can also attend social events where they can meet and collaborate with other student musicians. Lastly, students can choose to receive email updates containing information about nearby music learning or collaboration opportunities.",Group,https://dukegroups.com/siren/,0,0,
447,Sisters in STEM,"Sisters in STEM (SIS) is a group that gives Black women in STEM at the graduate level at Duke a place to get together and socialize on a monthly basis throughout the semester. We give members a safe place to express their ideas, support one another, and network with other Black women in STEM across various graduate programs on campus. We are devoted to creating an accepting community where everyone can be seen and heard.",Group,https://dukegroups.com/SIS/,0,0,
448,Skate Club,"Skate Club is a community for skateboarders. In line with the skateboarding communityâs pride in fostering inclusive and supportive environments as a whole, Skate Club looks to host events and sessions involving skateboarding while creating more awareness about skateboarding on campus. Skating in and of itself brings a myriad of benefits - aside from being a great form of exercise, skateboarding is a great means to work the mental muscles for overcoming fear and commitment. Most importantly, our club is an excellent means to building strong bonds with others through skateboarding. A space in which individuals of all backgrounds can participate in a fun hobby that exercises the body and the mind while providing an opportunity to make new friendships--this is our mission.",Group,https://dukegroups.com/SK8CLUB/,0,0,
449,Medical Physics Graduate Program Student Leadership and Advisory Council,"To know about it, reach out to people from the reference link.",Group,https://dukegroups.com/SLAC/,0,0,
450,Student Organization Finance Committee,"An independent branch of DSG, SOFC is responsible for the recognition, funding, and support of 350+ student organizations at Duke. In collaboration with campus partners, we work to approve and onboard new groups, ensure the effective distribution and investment of Dukeâs nearly $1M student fund, and elevate the voices of student leaders. Our goal is to enhance the undergraduate Duke experience by supporting engagement opportunities, student involvement, and inclusive programming.",Group,https://dukegroups.com/SOFC/,0,0,
451,Duke Student Occupational Therapy Association,"Encourage unity, professional growth, and community service among Duke occupational therapy students.  Provide a means of professional connection between Duke students and the Occupational Therapy profession at local, state, and national levels. Academically engage and logistically support Occupational Therapy students. Promote awareness of the occupational therapy profession.	 Sponsor social events with the OTD community. Uphold and honor the Duke OTD program’s vision for fostering equitable participation through occupation focused events.",Group,https://dukegroups.com/SOTA/,0,0,
452,Southgate House Council,"To know about it, reach out to people from the reference link.",Group,https://dukegroups.com/Southgate/,0,0,
453,"Duke SPACE (Science Policy, Advocacy, Communication and Ethics)","The mission of SPACE is to educate its members in the fields of science policy, advocacy, communication and ethics while providing opportunities to put these skills into practice. It will also aim to expose members to careers in the above areas and provide networking opportunities throughout the year.",Group,https://dukegroups.com/SPAcE/,0,0,
454,DUU Special Events,"The Duke University Union aims to provide diverse, community-based and creative programming and media for all students at Duke University. The Duke University Union shall initiate, promote and execute programming and media production in a manner that satisfies the evolving needs of the Duke University community and complements the social, educational and professional aims of the students of Duke University.",Group,https://dukegroups.com/Spev/,0,0,
455,SPIRE LLC,"To know about it, reach out to people from the reference link.",Group,https://dukegroups.com/spirellc/,0,0,
456,STEM Pre-Professional and Undergraduate Research Society,"To know about it, reach out to people from the reference link.",Group,https://dukegroups.com/SPURS/,0,0,
457,Sanford Run Club,"The mission of the Sanford Run Club is to promote community and a healthy lifestyle through social runs and walks around campus and the Durham community. Sanford Run Club facilitates a welcoming environment where anyone looking for activity and community can join and destress with friends.  Club membership means becoming part of a community that values support, friendship, camaraderie, and fun.",Group,https://dukegroups.com/SRC/,1,0,
458,Sanford School of Public Policy Student Council,"The Sanford Student Council supports the endeavors of the Master of Public Policy (MPP) student body, ensures studentsâ needs and goals are heard, and promotes Terry Sanfordâs legacy of doing the right thing in a difficult moment.  The Council brings concerns, questions, and recommendations regarding the MPP program to the administration. The Council facilitates student involvement in Sanford School planning in partnership with the Director of Graduate Studies and MPP Director of Student Services.",Group,https://dukegroups.com/SSC/,0,0,
459,Students Supporting Israel,"Our mission is to be a clear and confident pro-Israel voice on college campuses, and to support students in grassroots pro-Israel advocacy. We are committed to promoting a better understanding of Israel throughout North America as a member of the family of nations, with a fundamental right to exist as a Jewish, democratic state, within secure borders. We want to provide students on college campuses and universities with the opportunity to support the position of Israel in the Middle East, and to reassure students who opposed the demonization of the State of Israel on campus that they are not alone. We are changing the anti-Israel climate many students encounter on campus. By being part of a united, strong and thriving international movement, students are empowered to express their views in support of Israel. Our goals and activities include familiarizing students and the university community with current events in the Middle East, sharing Israeli culture on campus, and responding to bias anti-Israel propaganda when spread by other members of the academic community. We believe in sharing knowledge with students about Israel’s history, its diverse people, and its day to day reality, as Israel should not be looked at solely through the lens of conflict but as a nation with legitimate and unique story, values and aspirations. ​We believe in the idea of Zionism, and as stated in the Declaration of the Establishment of the State of Israel that the Jewish people have the natural right ""to be masters of their own fate, like all other nations, in their own sovereign state... a Jewish State."" Students Supporting Israel is an independent, nonpartisan, grassroots campus movement that was created by students, for students, in order to organize a strong and united pro-Israel front on college campuses. We are made up of students from different political, religious, and ethnic backgrounds, all working together as Students Supporting Israel. We believe in grassroots action, and want to empower students who support Israel on campus to lead their fellow students and the campus community.",Group,https://dukegroups.com/SSI/,0,1,
460,Statistical Science Majors Union,"The mission of the StatSci Majorâs Union is to foster community within the undergraduate program as well as reach out to members of the wider Duke community who are interested in Statistical Science. The StatSci Majorâs Union seeks to accomplish this mission by hosting events that encourage relationships between students and professors, contributing to Data Fest, and hosting panels, workshops and meetings for academic and career development.",Group,https://dukegroups.com/SSMU/,0,0,
461,Stargazing Devils Astronomy Club,"â¢	Enhance Astronomy instruction and STEM education at Duke by providing hands-on observation experiences and learning opportunities for students, in collaboration with Duke Teaching Observatory and Duke Physics Department.",Group,https://dukegroups.com/stargazingdevils/,0,0,
462,Duke STEM Connect,To engage students from Durham Public Schools and encourage them in learning STEM and discovering new ideas on their own,Group,https://dukegroups.com/STEM/,0,0,
463,Sanford Urban Policy Club,"The Sanford Urban Policy Club (SUP) is a graduate student organization at the Sanford School of Public Policy that provides a forum for students to discuss and engage with urban issues within our local community of Durham and across the country. We provide opportunities for formal and informal engagement with students, faculty, and guest experts to understand best practices and current challenges for local policy decisions. The Sanford Urban Policy Club creates space for dialogue around how policy areas intersect in urban spheres. We strive to better understand a range of issues, from sustainable urban growth to equitable housing policy to transportation innovation.",Group,https://dukegroups.com/SUP/,0,0,
464,Duke Sustainability Board,"The Duke Sustainability Board (DSB), housed in the Nicholas School of the Environment, promotes awareness of sustainability initiatives and complex environmental issues. We are an organization uniquely positioned to facilitate communication among all clubs in the Nicholas School, because we can connect students from various disciplines through a common appreciation of sustainable development.",Group,https://dukegroups.com/Sustainability/,0,0,
465,Sanford Veterans Association,"Sanford Veterans Association (SVA) fosters a supportive community for Active Duty, retired, and separated service members at the Sanford School of Public Policy.",Group,https://dukegroups.com/SVA/,0,0,
466,Swift Quad Council,"To know about it, reach out to people from the reference link.",Group,https://dukegroups.com/swift/,0,0,
467,Sanford Women in Policy,"Sanford Women in Policy (SWP) is a graduate student organization at the Sanford School of Public Policy that provides a forum to discuss and address challenges and opportunities for women in the field of public policy. SWP also serves as a space to cultivate, empower, and promote unity and fellowship for those who identify as women and their allies. SWP creates opportunities for leadership, professional development, and dialogue for its members. We aim to do this by hosting discussions with speakers, networking events, skills workshops, and social events. SWP also serves as a space for students to discuss gender-related public policy issues.",Group,https://dukegroups.com/SWP/,0,0,
468,Taiwanese American Student Association,"Duke Taiwanese-American Students Association (TASA) was started with the goal of uniting the Taiwanese and Taiwanese American undergraduate students at Duke University. Since then, we have expanded from a scattered group of a few individuals to a much larger, social circle. We work towards promoting the Taiwanese culture among Duke Students as well as providing some comfort for those far away from home. We enjoy celebrating traditional holidays such as Moon Festival, Lunar New Year, and Dragon Boat festival with the typically associated foods like moon cakes, hot pot, and bamboo leaf rice pyramids. We also love singing karaoke and playing Taiwanese games like Big 2 and Mah Jong. Our signature events are all related to food - Dumpling Nights and Taiwanese Iron Chef.",Group,https://dukegroups.com/TASA/,0,0,
469,The Backpack Project: Durham,"The mission of The Backpack Project, Inc, is to pack and hand-deliver backpacks filled with essential supplies; establish a personal connection to uplift each client that we encounter; and connect our clients to other homeless service providers within their community.",Group,https://dukegroups.com/TBPDurham/,0,0,
470,Team One Love at Duke,The mission of One Love is to empower Duke students to take action in the movement to end intimate partner violence. One Love seeks to accomplish this mission by facilitating Escalation Workshops and other signature One Love workshops which will allow the Duke community to better understand the mission of the One Love Foundation.,Group,https://dukegroups.com/teamonelove/,0,0,
