Column1,Name,Description,Type,Reference,Sports,Spiritual,
0,Badminton,"Badminton Club offers a weekly opportunity for students to play badminton and network with others.  Whether you are new to the sport or highly skilled, everyone is welcome. All equipment is provided.",Group,https://sites.duke.edu/prattgsps/student-clubs/,1,0,
1,Bean Together Coffee,"Bean Together Coffee Club fosters wellness and community-building by hosting coffee events. By exploring coffee’s many flavors and permutations as a group, and by structuring our events around poetry recitation, discussion topics, and other community-building techniques, we will encourage attendees to develop new friendships and improve their mental well-being.",Group,https://sites.duke.edu/prattgsps/student-clubs/,0,0,
2,Dance,Dance Club unites the members of the engineering community through different types of dance from a wide range of cultures and backgrounds.,Group,https://sites.duke.edu/prattgsps/student-clubs/,0,0,
3,Diversity and Culture,"Diversity and Culture Club seeks to connect students, faculty, and staff from all different backgrounds and engineering concentrations with exciting social events celebrating various cultures.  The club also seeks to foster awareness of diversity in STEM  through education and empowerment.",Group,https://sites.duke.edu/prattgsps/student-clubs/,0,0,
4,Media,"Media Club engages our students interested in expressing themselves through photography and cinematography. Participants can attend photo editing workshops, learn techniques, and collaborate with others on fun photography projects. No experience or special equipment needed. They love to remind you that the “best” camera is the one you have with you. Learn more here.",Group,https://sites.duke.edu/prattgsps/student-clubs/,0,0,
5,Sports,"Sports Club provides a safe and inclusive community where students can participate in sports and physical activities that enhance their personal, social, and physical well-being. They aim to foster a sense of belonging and teamwork through sports, and to create opportunities for skill development, competition, and leadership. Learn more here.",Group,https://sites.duke.edu/prattgsps/student-clubs/,1,0,
6,Sustainability,"Sustainability Club aims to inspire and engage master’s community in making positive changes for the environment and future generations by promoting awareness and education on all aspects of sustainability, including relevant topics in climate tech and the growing career opportunities within this field.",Group,https://sites.duke.edu/prattgsps/student-clubs/,0,0,
7,Engineering Master’s Programs Student Advisory Board,"The Engineering Master’s Programs Student Advisory Board (SAB) is comprised of students who represent the various engineering master’s programs and departments at the Pratt School of Engineering. SAB members are the voice for their engineering community, and provide school leadership with valuable insight by expressing the needs and ideas of our students. Using that feedback, they team with the Graduate Student Programs and Services staff to build a strong and vibrant engineering master’s programs community.",Board,https://sites.duke.edu/prattgsps/engineering-masters-programs-student-advisory-board/,0,0,
8,Climate Crisis Committee (CCC),"If you want to see a truly green Duke University, join GPSG’s Climate Crisis Committee! We work on issues all across campus like divesting our endowment from fossil fuels, improving mental health resources to cope with climate change, advancing environmental justice commitments, and reducing waste from graduate and professional programs. Join us to help us build a more sustainable and equitable future!",Committee,https://gpsg.duke.edu/committees/,0,0,
9,"Diversity, Equity, and Inclusion Committee (DEI)","The GPSG DEI Committee is tasked with identifying ways to continuously promote diversity, equity, and inclusion on campus. One major way this is accomplished is through connecting with DEI leaders across campus, be they students, faculty, or staff. Members of the DEI Committee work to impart meaningful change on campus through conversations with administration, passing key resolutions through the GPSG assembly, and collaboration with other student groups both within and without the GPSG body. As issues of Diversity, Equity, and Inclusion can touch many aspects of student life, the DEI Committee is open to approach about any topic.",Committee,https://gpsg.duke.edu/committees/,0,0,
10,GPSG CAN,"GPSG CAN is the Duke University graduate and professional student chapter of Durham CAN, focused on broad-based advocacy in the Durham area.",Committee,https://gpsg.duke.edu/committees/,0,0,
11,Doctoral Student Affairs Committee (DSA),The Doctoral Student Affairs Committee is tasked with addressing campus-wide issues that affect doctoral students.,Committee,https://gpsg.duke.edu/committees/,0,0,
12,External Advocacy Committee (EAC),"The External Advocacy Committee is tasked with organizing GPSG’s advocacy efforts at the state and federal levels, including voter registration, communicating issues to state and federal legislators, and engaging with student advocates at other institutions of higher education. Committee members are invited to participate in an annual trip to DC to speak with federal lawmakers and their staff.",Committee,https://gpsg.duke.edu/committees/,0,0,
13,Parking and Transportation Committee (P&T),The Parking and Transportation Committee is tasked with addressing issues of parking and transit at Duke University and in the Durham area.,Committee,https://gpsg.duke.edu/committees/,0,0,
14,Rules Committee,"The Rules Committee is tasked with maintaining GPSG’s constitution, bylaws, and standing rules of order, addressing questions about GPSG operating rules, receiving complaints, and adjudicating disputes.",Committee,https://gpsg.duke.edu/committees/,0,0,
15,International Student Affairs Committee (ISA),The International Student Affairs Committee is tasked with advocating for the concerns of graduate and professional international students on campus.,Committee,https://gpsg.duke.edu/committees/,0,0,
16,Events Programming Committee,The GPSG Director of Events Programming is charged with hosting social programming available to all graduate and professional students.,Committee,https://gpsg.duke.edu/committees/,0,0,
17,GPSG Community Pantry,"This is not a standing committee, but the Community Pantry is a service of GPSG that provides non-perishable foods and meals to graduate and professional students struggling with food insecurity.",Committee,https://gpsg.duke.edu/committees/,0,0,
18,GPSG Assembly,"This is not a standing committee, but the Assembly is the legislative branch of GPSG. All Duke graduate and professional students are automatically members of the Assembly and may attend any and all Assembly meetings to listen in and bring up topics for discussion with representatives from every graduate and professional school and program at Duke. Assembly meetings occur every other Tuesday, 6:30pm – 8:30pm ET over Zoom.",Committee,https://gpsg.duke.edu/committees/,0,0,
19,Lawyer Assistance Program,"The GPSG Lawyer Assistance Program provides students with legal counseling, risk reduction, and mitigation of legal issues.",Resource,https://gpsg.duke.edu/resources-for-students/lawyer-assistance-program/,0,0,
20,Funding for Student Groups,"The Duke Graduate and Professional Student Government encourages students to form groups around social, academic, and cultural similarities. To support these groups, the GPSG allocates a large portion of its budget to funding events and materials for these groups.",Resource,https://gpsg.duke.edu/resources-for-students/resources-for-student-groups/,0,0,
21,Individual Counseling & Psychiatric Services,Individual counseling provides students the opportunity to meet with a provider and collaboratively work to determine and agree upon goals of treatment in a one-on-one setting. It's part of Counseling and Psychological Services (CAPS),Service,https://students.duke.edu/wellness/caps/individual/,0,0,
22,Group Counseling,Our Group Services include group therapy and discussion groups with a variety of goals that aim to promote wellbeing. Research demonstrates that group therapy is equally effective as individual therapy and is often the treatment of choice for student issues. It's part of Counseling and Psychological Services (CAPS),Service,https://students.duke.edu/wellness/caps/group/,0,0,
23,Workshops & Discussions,"We provide a wide range of interactive, skill-building workshops on various mental health topics for the entire Duke community. It's part of Counseling and Psychological Services (CAPS)",Service,https://students.duke.edu/wellness/caps/,0,0,
24,Referrals to Community Providers,"Our primary goal is to ensure students have access to the best possible care based on their unique needs and sometimes this means working with a professional outside of Counseling and Psychological Services (CAPS). To start, you can meet with our referral coordinator or browse our list of community providers.",Service,https://duke.miresource.com/,0,0,
25,Baldwin Scholars,"The Baldwin Scholars program contributes to Duke Universityâs mission âto provide a superior liberal education to undergraduate students, attending not only to their intellectual growth but also to their development as adults committed to high ethical standards and full participation as leaders in their communities...â",Group,http://baldwinscholars.duke.edu/,0,0,
26,Duke Best Buddies,The mission of BB is to make a positive impact on the lives of individuals with developmental and intellectual disabilities in the Durham area. BB seeks to accomplish this mission by hosting events that seek to build meaningful relationships between Duke students and individuals with intellectual and developmental disabilities in the Durham area and by having awareness events that raise awareness and inclusion for the disability community.,Group,http://bestbuddies.org/,0,0,
27,Chapel Choir,"The Chapel Choir is a close-knit collection of students, alumni, faculty, staff, and community members who sing a variety of repertoire and major choral works during the academic year.",Group,http://chapel.duke.edu/sing,0,0,
28,Duke Democrats,Duke Democrats is the affiliate of the Democratic Party at Duke University. We are a political and social group dedicated to electing Democrats and fighting for social justice and progressive policies.,Group,http://devildems.com/,0,0,
29,Devils en Pointe,"The mission of DEP is to learn, perform, and share ballet, both creating new works and drawing upon choreography from classical and contemporary repertory. We strive to serve as a bridge between the Duke Dance Program ballet faculty and Duke University's ballet students.",Group,http://devilsenpointe.org/,0,0,
30,DukeAFRICA,"DukeAFRICA values representation, inclusion, and acceptance of all African students at Duke. We are a family of students that are passionate about the continent of Africa and are determined to educate the Duke community culturally, intellectually, and socially about African truths in an effort to deconstruct false impressions. Students can find a warm and welcoming environment in which to celebrate and understand the diverse history of the African continent.",Group,http://dukeafricablog.wordpess.com/,0,0,
31,alpha Kappa Delta Phi,"Our mission is to provide sisterhood among women, and to promote scholarship, leadership and Asian awareness in the University and community. Further, to provide a support group for those in their times of need and to encourage the making of successful women.",Group,http://dukeakdphi.com/,0,0,
32,Duke Chinese Theater,"The mission of Duke Chinese Theater is to unite those who are passionate about Chinese theater to regularly present Chinese theater pieces for our community, and to raise awareness of Chinese culture. DCT seeks to accomplish this mission by putting on a public performance every semester, and by hosting Chinese theater workshops and events.",Group,http://dukechinesetheater.weebly.com/,0,0,
33,Club Swimming,"Duke Club Swimming is an inclusive, student-run club for swimmers of all abilities and types!",Group,http://dukeclubswimming.blogspot.com/,1,0,
34,Duke Conservation Tech,"Blueprint is a sustainable tech ideation conference presented by Duke Conservation Tech: we bring together passionate students, visionary experts, and driven organizations to address critical environmental issues. We combine the unbridled optimism of students with real-world experience of experts to foster courageous and interdisciplinary innovations that address our planets complex, escalating challenges.",Group,http://dukeconservationtech.com/,0,0,
35,Duke University Debating Society,"Duke University Debate Society competes in the British Parliamentary format of debate. We hope to develop our members' skills in critical thinking and public speaking, and to grow their general knowledge. We also hope to foster a community of outspoken, well informed, and cooperative thinkers.",Group,http://dukedebate.org/,0,0,
36,Duke Dhamaka,"The mission of Duke Dhamaka is to promote South Asian culture and awareness on campus by engaging in on-campus performances and hosting social dance events and workshops. Dhamaka also guest performs in showcases for other dance groups on campus. In addition, as a Duke team, Dhamaka represents Duke nationwide in competitions and fosters Duke athletic spirit and enthusiasm.",Group,http://dukedhamaka.weebly.com/,0,0,
37,Duke University EMS,"DUEMS seeks to promote the values of health, service, leadership, and teamwork among the Durham community. We provide volunteer emergency medical care to Duke University at sporting and campus events under Duke Life Flight.",Group,http://dukeems.org/,0,0,1
38,Duke Engage,"Through DukeEngage, students and faculty collaborate with communities  locally and globally  to address critical social issues through an immersive summer of community engagement.",Group,http://dukeengage.duke.edu/,0,0,
39,Club Equestrian,The Duke University Equestrian Team (DUET) is a talented group of athletes who strive to be competitive in the Intercollegiate Horse Show Association (IHSA) while also practicing safe and enjoyable horsemanship.,Group,http://dukeequestrian.wordpress.com/,1,0,
40,Gente Aprendiendo para Nuevas Oportunidades,"GANO's mission is to provide provide free, accessible, and high quality English tutoring to the Hispanic community in the Raleigh-Durham area.",Group,http://dukegano.wordpress.com/,0,0,
41,Blue Devils Versus Cancer,"The purpose of this organization is to support the Duke Cancer Institute (DCI) in their effort to fundraise for cancer research, help improve patient care and accelerate the translation of cancer-related discoveries in the lab into better treatment for cancer patients.",Group,http://dukegroups.duke.edu/bdvsc,0,0,
42,Duke University Indian Students Association (Graduate),"Aims to foster social exchange between all Indian graduate students, post-doctoral fellows, employees as well as members of the Duke University community interested in Indian culture at Duke, through social and cultural events.",Group,http://dukegroups.duke.edu/disa/,0,0,
43,Hurston-James Society,"The Hurston-James Society provides academic, social, and professional support for minority graduate students in the humanities and social sciences. Named for Zora Neale Hurston, novelist and anthropologist, and C.L.R. James, historian, novelist, critic, and social activist, the Society addresses issues relevant to their survival and growth as members of the academic community. Membership in the Hurston-James Society is open to all students of color enrolled in the Duke Universityâs Graduate School or in graduate programs at other Triangle area universities.",Group,http://dukegroups.duke.edu/hjsociety/,0,0,
44,Bench and Bar Pre-Law Society,The mission of Bench and Bar is to provide services to undergraduates interested in,Group,http://dukegroups.duke.edu/prelaw/,0,0,
45,Duke Lasya,"We are Duke Lasya, Duke University's premier classical Indian dance team. Our members are trained in Bharatanatyam, Kuchipudi, Kathak, and Odissi (and we even have some novice classical dancers!) We strive to maintain the traditional elements of our classical dance upbringing while fostering a creative and independent spirit in our choreography through incorporation of modern and classical music. We aim to tell stories important to us as women, as Indian Americans, as college students, through dance. As Duke's representation in the world of collegiate classical dance, we compete at various competitions across the nation, and we also showcase our cultural heritage through performances on campus throughout the year.",Group,http://dukelasya.wixsite.com/dukelasya,0,0,
46,Duke Moot Court,"Duke Moot Court is a student-led undergraduate organization which seeks to provide students with opportunities to engage in legal reasoning, learn more about constitutional jurisprudence, and form positive connections with students, faculty, and pre-law resources through a collaborative and supportive community.",Group,http://dukemootcourt.strikingly.com/,0,0,
47,Duke Performances,"Duke Performances â the professional performing arts presenting organization at Duke University in Durham, North Carolina â is dedicated to bringing world-class performing artists, who are diverse, essential, and forward thinking, to perform at Duke and in Durham, to engage the Duke and Durham communities and beyond, and to partner with artists on the development and presentation of performance. Drawing on the resources of a leading research university and an exciting and invigorated Durham community, Duke Performances serves as a space for reflection, a laboratory for creative and critical inquiry, and a place for socially engaged performance.",Group,http://dukeperformances.org/,0,0,
48,Duke Robotics Club,"The Duke Robotics Club is a student-run organization in Duke Universityâs Pratt School of Engineering. Our mission is to provide Duke undergraduate and graduate students a place to pursue their interest in robotics by working on high-impact, large-scale robotics projects and competitions, primarily in the realm of Autonomous Underwater Vehicles (AUVs). These projects allow our talented students to hone their skills and demonstrate the strength of Duke Engineering.",Group,http://duke-robotics.com/,0,0,
49,Sabrosura,"At present, Sabrosura specializes in a wide selection of dance forms: salsa, merengue, bachata, cha cha, tango, flamenco, samba, reggaeton, lambada, hip-hop, and modern. Having endured unprecedented growth with regard to the sheer size and diversity of its membership, as well as the breadth of its creative repertoire, Sabrosura hopes to continue to inspire and entertain those members of the Duke and Durham communities that cherish the passion and excitement so unmistakably characteristic of Latin dance.",Group,http://dukesabrosura.weebly.com/,0,0,
50,Society of American Foresters: Duke Chapter,"Founded in 1900 by Gifford Pinchot, the Society of American Foresters (SAF) is the national scientific and educational organization representing the forestry profession in the U.S. SAFâs mission is to advance the science, education, technology, and practice of forestry; to enhance the competency of its members; to establish professional excellence; and to use the knowledge, skills, and conservation ethic of the profession to ensure the continued health and use of forest ecosystems and the present and future availability of forest resources to benefit society.",Group,http://dukesaf.blogspot.com/,0,0,
51,Club Sailing,"As a member of the South Atlantic Intercollegiate Sailing Association (SAISA), Duke Sailing competes all over the Southeast in the fall and spring seasons against both club teams and nationally-ranked varsity teams. We travel to regional regattas dedicated to promoting sailing within the conference, as well as inter-conference regattas that host top teams from all across the country.",Group,http://dukesailing.weebly.com/,1,0,
52,Something Borrowed Something Blue,To spread the message of God through music and fellowship.,Group,http://dukesbsb.com/,0,0,
53,Duke Smart Home,"The Duke University Smart Home is an organization whose purpose is to create an interconnected living environment that will contribute to the innovation and demonstration of the future of sustainable building technology. It will provide students at Duke University with an opportunity for practical hands-on engineering outside of the classroom in a living and learning community. Furthermore, our organization will provide a channel for Duke University to spearhead the drive for advanced living technology and encourage public awareness of such technology. For these reasons, we do hereby establish ourselves as the Duke Smart Home and establish this constitution as our governing law.",Group,http://dukesmarthome.com/,0,0,
54,Sustainable Ocean Alliance,"The mission of SOA is to promote and strengthen student interest, knowledge, and engagement with ocean related research and policy.",Group,http://dukesoa.squarespace.com/,0,0,
55,Club Squash,"After building two regulation-sized courts in the winter of 2015, the Duke Squash program has been growing quickly and promisingly. Over the past several years the now co-ed team has gone on to play tournaments at UVA, New York City, Chapel Hill, Charlotte, and Baltimore. The season culminated with a dream trip to Barcelona over spring break where the players trained with professionals at the prestigious Barcelona Global Squash program.",Group,http://dukesquash.wordpress.com/,1,0,
56,Street Medicine,"Street Medicine is a Duke performance group focused on Hip-Hop/Street-Style dance and culture. By providing a space for Duke students of all skill levels to learn and engage with this culture, Street Medicine seeks to develop a greater interest in street-style dance history and foundations at Duke University, to increase access to dance education and performance opportunities, and to connect interested students with the greater dance and Durham community.",Group,http://dukestreetmedicine.com/,0,0,
57,Duke Student Government,Duke Student Government (DSG) is the governing body of undergraduate students at Duke University.,Group,http://dukestudentgovernment.org/,0,0,
58,Temptasians A Cappella Group,"The Temptasians is a co-ed a cappella group dedicated to appreciating music that is specific but not limited to Chinese, Japanese, Korean songs.",Group,http://duketemptasians.com/,0,0,
59,Juris: Duke's Undergraduate Law Magazine,"To publish scholarly work displaying extensive academic work, writes and compiled by underrates whose main purpose is publication.",Group,http://dukeundergraduatelawmagazine.org/,0,0,
60,DUU Marketing,"DUU is Dukes institutional, student-led event, programming, arts and media body, and the schools largest student organization! Each year, DUU committees design and execute over 200 events and media, ranging from weekly Jazz@ the Mary Lou, to Duke Student Broadcasting videos in association with Duke Basketball, and even to the LDOC Concert. Our mission is simple: to provide diverse, community-based and creative programming and media that complements the social, educational, and professional aims of Duke University.",Group,http://duuke.org/,0,0,
61,DUU Jazz@,Jazz@ is a student organization that seeks to connect the jazz artist with the jazz audience at Duke.,Group,http://duuke.org/jazz/,0,0,
62,Duke German Club,"Our purpose is to promote and increase awareness of German language, culture, society, politics, and history across Duke University, including undergraduates, graduates, faculty, vising scholars, and staff. D.G.C. is primarily a cultural organization but also values cross-cultural awareness and understanding.",Group,http://german.duke.edu/undergraduate/duke-german-club,0,0,
63,GlobeMed at Duke,"The mission of GlobeMed at Duke is to strengthen the movement for global health equity on campus, in the Durham community and in the international community.",Group,http://globemedatduke.wix.com/home,0,0,
64,Student Advisory Board at the DHRC@FHI,"The Duke Human Rights Center @ the Franklin Humanities Institute brings together an interdisciplinary group of scholars, staff, and students to promote new understandings of and action on human rights. We engage with issues of race, ethnicity, gender, sexuality, religion, income inequality, the environment, the philosophy and history of human rights, the literature that emerges alongside it, linguistic rights, and artistic responses in our research, teaching, programming, and outreach. Our goal is to foster strategies and collaborative, cross-disciplinary, and critical thinking about human rights in both local and global contexts. The Center is committed to social justice.  In partnership with the FHI, we see the humanities as an essential frame and launch point for inquiry. We develop undergraduate courses and global experiences, sponsor campus-wide events that encourage awareness and activism on human rights, and engage in long-term partnerships with community-based organizations.",Group,http://humanrights.fhi.duke.edu/students/student-advisory-board/,0,0,
65,"Delta Sigma Theta Sorority, Inc.","Delta Sigma Theta Sorority, Incorporated is an organization of college educated women committed to the constructive development of its members and to public service with a primary focus on the Black community.",Group,http://lambdaomegadst.com/,0,0,
